{
  "hardness_axes": [
    {
      "id": "discover",
      "name": "Discover",
      "verdict": "PASS",
      "reasoning": "The public symptoms describe ordinary local norms with twin fold-checksum disagreement and a healthy steady control, but they do not identify the post-map fringe packing layout, the stage-authority lag across the language boundary, or the pre-map fold ordering. Those facts must be recovered from C, Rust, logs, and twin/control runs."
    },
    {
      "id": "synthesize",
      "name": "Synthesize",
      "verdict": "PASS",
      "reasoning": "Map-changed/steady parity requires coordinated behavior across native fringe pack/unpack, shared-boundary stage metadata, and fold/reduce ordering for global checksums. No single module owns the complete invariant."
    },
    {
      "id": "diagnose",
      "name": "Diagnose",
      "verdict": "PASS",
      "reasoning": "The instruction reports local-norm-green / fold-checksum disagreement, twin divergence, and healthy steady behavior without naming fringe packing, ownership, sync-stage lag, reduction order, or fix sites."
    },
    {
      "id": "navigate_coupling",
      "name": "Navigate coupling",
      "verdict": "PASS",
      "reasoning": "Correct fringe packing still fails if stage metadata marks complete early; correct stage authority still fails if folds retain pre-map order; and fold-only repairs leave twin sample contracts red when native packing and host authority disagree."
    },
    {
      "id": "reason_beyond_training",
      "name": "Reason beyond training",
      "verdict": "PASS",
      "reasoning": "A textbook force-full-exchange or 'flush all buffers' recipe cannot reconcile mixed-language rank-map twin checksums. The project-specific fringe-pack, stage-authority, and fold-order coupling is not a standard recipe completion."
    }
  ],
  "anti_trivialization_checks": [
    {
      "id": "disclosure_collapse",
      "name": "Disclosure-collapse",
      "verdict": "PASS",
      "reasoning": "An honest statement of twin fold-checksum parity, sample contracts, and steady byte stability does not reveal which of the three language-boundary authorities is inconsistent."
    },
    {
      "id": "hidden_instance",
      "name": "Hidden-instance",
      "verdict": "PASS",
      "reasoning": "The design covers map-changed cases, never-map-changed twins, and healthy steady controls across generated variants rather than hiding one corrupted fixture."
    },
    {
      "id": "single_artifact_repair",
      "name": "Single-artifact repair",
      "verdict": "PASS",
      "reasoning": "Three coordinated locations across distinct native/ and host/ roots are required; replacing one map blob or report cannot satisfy regenerated twin/control checks."
    },
    {
      "id": "generalization",
      "name": "Generalization",
      "verdict": "PASS",
      "reasoning": "The verifier regenerates map-changed/steady pairs and steady controls from bundled families, so fixes must generalize beyond named cases."
    },
    {
      "id": "prompt_honesty",
      "name": "Prompt-honesty",
      "verdict": "PASS",
      "reasoning": "The instruction names observable parity failures, invocation, normative report schema path, and completion conditions while withholding only implementation causes and fix sites."
    },
    {
      "id": "cheating_vs_difficulty",
      "name": "Cheating-vs-difficulty",
      "verdict": "PASS",
      "reasoning": "Regeneration and twin/control matrices prevent hardcoding, but residual difficulty is cross-language rank-map diagnosis rather than those anti-cheating mechanisms."
    },
    {
      "id": "mechanical_fix_filter",
      "name": "Mechanical-fix filter",
      "verdict": "PASS",
      "reasoning": "The core work is not dependency placement, timeouts, reward formatting, or metadata repair."
    },
    {
      "id": "localized_fix",
      "name": "Localized-fix",
      "verdict": "PASS",
      "reasoning": "The selected topology places two locations in native/ and one in host/, each controlling 4 of 12 tests under a 0.5 concentration cap."
    },
    {
      "id": "oracle_locality",
      "name": "Oracle-locality",
      "verdict": "PASS",
      "reasoning": "The planned oracle performs substantive fringe-pack, stage-authority, and fold/digest changes rather than replacing one short file or toggling one compiler option."
    },
    {
      "id": "small_declarative_cluster",
      "name": "Small declarative-cluster",
      "verdict": "PASS",
      "reasoning": "No finite table, threshold list, schema block, or configuration cluster contains the solution; the cited schema only documents report keys."
    },
    {
      "id": "grep_collapse",
      "name": "Grep-collapse",
      "verdict": "PASS",
      "reasoning": "Selected fix paths and symbols use opaque ledge/shelf/ember and braid_q/latch_r/sift_s vocabulary that does not contain any noun extracted from the public instruction."
    },
    {
      "id": "pre_factored_helper",
      "name": "Pre-factored-helper",
      "verdict": "PASS",
      "reasoning": "The selected functions do not mirror public terms such as rank, map, fold, checksum, twin, exchange, or parity."
    },
    {
      "id": "recipe_discount",
      "name": "Recipe-discount",
      "verdict": "PASS",
      "reasoning": "A known force-sync or global-buffer-flush recipe cannot repair the fringe-pack layout, stage-authority lag, and fold-order coupling together."
    },
    {
      "id": "security_aura_discount",
      "name": "Security-aura discount",
      "verdict": "PASS",
      "reasoning": "This is a scientific-computing task and does not rely on security language or exploit framing for difficulty."
    },
    {
      "id": "orthogonal_checklist",
      "name": "Orthogonal-checklist",
      "verdict": "PASS",
      "reasoning": "Twin parity, sample contracts, and steady stability are one coupled rank-map invariant spanning three authorities, not independent checklist bullets."
    },
    {
      "id": "harness_discount",
      "name": "Harness-discount",
      "verdict": "PASS",
      "reasoning": "Docker and mixed-language compilation provide realism, while residual hardness comes from fringe packing, stage authority, and numerical fold decisions."
    },
    {
      "id": "one_pass_solvability",
      "name": "One-pass solvability",
      "verdict": "PASS",
      "reasoning": "Opening the obvious entrypoint does not reveal the three locations, and a naive global flush leaves twin fold and packing failures."
    },
    {
      "id": "hard_only_gate",
      "name": "Hard-only gate",
      "verdict": "PASS",
      "reasoning": "The bounded task requires professional domain-decomposition numerics, mixed-language FFI diagnosis, and twin-control scientific verification within an expert-hours scope."
    },
    {
      "id": "discovery_budget_test",
      "name": "Discovery budget test",
      "verdict": "PASS",
      "reasoning": "Three non-trivial discoveries are committed below, each with a distinct planned location and a reason it must remain absent from the public instruction."
    },
    {
      "id": "instruction_specificity_test",
      "name": "Instruction specificity test",
      "verdict": "PASS",
      "reasoning": "The drafted instruction stays at symptoms-only: no algorithm names, thresholds, cause phrases such as ownership or sync-stage lag, or named fix sites."
    },
    {
      "id": "topology_distribution_test",
      "name": "Topology distribution test",
      "verdict": "PASS",
      "reasoning": "Three distinct candidate topologies are enumerated below, each requiring at least three coordinating locations; the selected topology distributes tests across three locations at 4/12 each."
    }
  ],
  "rubric_axes": [
    {
      "id": "verifiable",
      "name": "Verifiable",
      "verdict": "PASS",
      "reasoning": "Twin fold-checksum parity, sample contracts, steady byte stability, and regenerated parity_report.json checks are all programmatic."
    },
    {
      "id": "well_specified",
      "name": "Well-specified",
      "verdict": "PASS",
      "reasoning": "The symptoms-only instruction clearly identifies invocation, normative schema path, twin/control outcomes, and prohibited hardcoding without revealing implementation causes."
    },
    {
      "id": "solvable",
      "name": "Solvable",
      "verdict": "PASS",
      "reasoning": "The design bounds the defect to a small existing mixed-language partitioned field lab; an expert familiar with domain decomposition and FFI can complete the coordinated changes in roughly three to eight hours."
    },
    {
      "id": "difficult",
      "name": "Difficult",
      "verdict": "PASS",
      "reasoning": "The task stays hard after honest disclosure because local-norm-green twin disagreement does not identify which packing, stage, or fold authority is inconsistent."
    },
    {
      "id": "interesting",
      "name": "Interesting",
      "verdict": "PASS",
      "reasoning": "Reliable global digests after domain remapping is paid production work in partitioned PDE and multiphysics solvers."
    },
    {
      "id": "outcome_verified",
      "name": "Outcome-verified",
      "verdict": "PASS",
      "reasoning": "The tests accept any implementation producing correct twin/control numerical outcomes and do not require the oracle's exact code shape."
    }
  ],
  "instruction_completeness_test": {
    "verdict": "PASS",
    "reasoning": "The instruction is sufficient to judge the final parity report and twin/control outcomes but insufficient to locate or derive the three fixes without deeply reading and running the codebase."
  },
  "discovery_budget": [
    {
      "discovery": "After a rank map change, native fringe pack/unpack still uses the pre-map neighbor layout, so boundary values look locally ordinary while twin fold checksums diverge.",
      "planned_location": "environment/native/ledge.c::braid_q",